serial	token_full_name	token	description	price-usd	price_change_percentage	volume_24h_usd	circulating_market_cap_usd	onchain_market_cap_usd	holders
1	Binance-Peg Ethereum Token (ETH)	ETH	"Ethereum is a global, open-source platform for decentralized applications. Eth is fueling transactions on the Chain."	1277.85	0.074234	3477152949	1.5399E+11	773099250	1434523
2	Binance-Peg BSC-USD (BSC-USD)	BUSD	A pegged token by Binance which gives you the joint benefits of open blockchain technology and traditional currency by converting your cash into a stable digital currency equivalent.	1	0.000058	18406830852	65769944227	3183177920	5835894
3	Wrapped BNB (WBNB)	WBNB	"As the native coin of Binance Chain, BNB has multiple use cases: fueling transactions on the Chain, paying for transaction fees on Binance Exchange, making in-store payments, and many more."	289.12	0.016796	537999304	46250081041	1102983827	1767472
4	Binance-Peg USD Coin (USDC)	USDC	USD Coin (known by its ticker USDC) is a stablecoin that is pegged to the U.S. dollar on a 1:1 basis.	1	0.000058	1288891975	42758873402	879000000	577583
5	USDC (anyUSDC)		Cross-chain router protocol.	1	0.000058	1288891975	42758873402	3015960	1719
6	Binance-Peg BUSD Token (BUSD)	BUSD	"BUSD is a 1:1 USD-backed stablecoin approved by NYDFS and issued by Paxos on Ethereum. Binance provides Binance-Peg BUSD on other chains by locking an equivalent amount of assets on Ethereum. Note that Binance-Peg BUSD is provided by Binance, which is not issued by Paxos nor regulated by the NYDFS."	1	0.000058	3942378269	22105526278	4852215626	4353878
7	Binance-Peg XRP Token (XRP)	XRP	"XRP is a digital asset built for payments. It is the native digital asset on the XRP Ledger—an open-source, permissionless and decentralized blockchain technology that can settle transactions in 3-5 seconds."	0.39	0.000023	392899741	19606478977	107767535	250281
9	Binance-Peg Cardano Token (ADA)	ADA	Cardano (ADA) is a decentralized platform that will allow complex programmable transfers of value in a secure and scalable fashion. Cardano is built in the secure Haskell programming language.	0.31	0.000018	124139015	10844381863	88094871	501540
10	Matic Token (MATIC)	MATIC	"Matic Network brings massive scale to Ethereum using an adapted version of Plasma with PoS based side chains. Polygon is a well-structured, easy-to-use platform for Ethereum scaling and infrastructure development."	0.92	0.000053	230266894	8200261833	91579200	298474
11	Binance-Peg Polkadot Token (DOT)	DOT	"Polkadot is a blockchain project that aims to connect blockchains, to enable the transfer of value and logic across chains. DOT is the native coin of the network."	5.31	0.000308	111586449	6076279612	84882547	189340
12	Binance-Peg Dai Token (DAI)	DAI	"Dai is a stable cryptocurrency supported by Maker (MKR). To ensure price stability, Dai minimizes the price volatility against the US dollar, through an incentive structure for its participants."	1	0.000058	92743435	5878615033	127523317	115962
13	Binance-Peg Litecoin Token (LTC)	LTC	"Litecoin is a peer-to-peer Internet currency that enables instant, near-zero cost payments to anyone in the world. Litecoin is an open source, global payment network that is fully decentralized without any central authorities."	77.25	0.004488	325387829	5540400900	56006250	62193
14	Binance-Peg SHIBA INU Token (SHIB)	SHIB	SHIBA INU is an experiment in decentralized spontaneous community building.	0	0	59926052	5086435574	68459482	1006384
15	Binance-Peg Uniswap (UNI)	UNI	Uniswap is an automated liquidity protocol powered by a constant product formula and implemented in a system of non-upgradeable smart contracts on the Ethereum blockchain.	6.16	0.000358	56815466	4691689205	29545831	59612
16	Binance-Peg Avalanche Token (AVAX)	AVAX	"Avalanche is an umbrella platform for launching decentralized finance (DeFi) applications, financial assets, trading and other services."	13.47	0.000783	90528649	4183725515	26940603	99369
17	Binance-Peg ChainLink Token (LINK)	LINK	"A blockchain-based middleware, acting as a bridge between cryptocurrency smart contracts, data feeds, APIs and traditional bank account payments."	6.91	0.000401	167883671	3402057658	59426000	127332
18	Binance-Peg Cosmos Token (ATOM)	ATOM	"Cosmos is a decentralized network of independent parallel blockchains, each powered by BFT consensus algorithms like Tendermint consensus."	9.76	0.000567	68400345	2796188444	18552057	48328
19	Binance-Peg Ethereum Classic (ETC)	ETC	"Ethereum Classic (ETC) is a hard fork of Ethereum (ETH) that launched in July 2016. Its main function is as a smart contract network, with the ability to host and support decentralized applications (DApps). Its native token is ETC."	19.31	0.001122	79225431	2670815903	15446363	28578
20	Binance-Peg BitTorrent Token (BTT)	BTT	BitTorrent is a popular peer-to-peer (P2P) file sharing and torrent platform.	0	0	1048627	2517192710	5181956	78572
21	Binance-Peg Bitcoin Cash Token (BCH)	BCH	Bitcoin ABC is an electronic cash platform that allows peer-to-peer online cash payments. It is a fork (a copy in a way) of Bitcoin (BTC).	110.31	0.006408	100803873	2123691042	9541741	16226
22	Binance-Peg NEAR Protocol (NEAR)	NEAR	"NEAR Protocol is a decentralized application platform designed to make apps usable on the web. The network runs on a Proof-of-Stake (PoS) consensus mechanism called Nightshade, which aims to offer scalability and stable fees."	1.72	0.0001	34936301	1440059453	11889674	36395
23	Binance-Peg EOS Token (EOS)	EOS	EOS is a cryptocurrency token and blockchain that operates as a smart contract platform for the deployment of decentralized applications and decentralized autonomous corporations.	1.04	0.000061	137449946	1124517967	14456700	38007
24	Binance-Peg Elrond Token (EGLD)	EGLD	"Elrond is a blockchain protocol that seeks to offer extremely fast transaction speeds by using sharding. The project describes itself as a technology ecosystem for the new internet, which includes fintech, decentralized finance and the Internet of Things."	46.03	0.002674	21602093	1095678193	13809985	31468
25	Trust Wallet (TWT)	TWT	Utility token to increase adoption of cryptocurrency.	2.58	0.00015	47515807	1075824956	2582083798	298775
26	Binance-Peg FLOW Token (FLOW)	FLOW	"Flow is a layer-1 blockchain that aims to be fast, decentralized, and developer-oriented. It is designed as the foundation to power games, apps, and the associated digital assets."	1.04	0.00006	27106819	1073096813	3418904	4428
27	Frax (FRAX)	FRAX	"Frax is a fractional-algorithmic stablecoin protocol. It aims to provide a highly scalable, decentralized, algorithmic money in place of fixed-supply assets like BTC. Additionally, FXS is the value accrual and governance token of the entire Frax ecosystem."	1	0.000058	5503202	1022243391	1033876	737
28	Binance-Peg Axie Infinity Shard Token (AXS)	AXS	"Axie Infinity is a Pokémon-inspired digital pet universe where anyone can earn tokens through skilled gameplay and contributions to the ecosystem. Players can battle, collect, raise, and build a land-based kingdom for their pets (known as Axies)."	8.53	0.000496	190278923	969495771	10321300	78425
29	Binance-Peg Tezos Token (XTZ)	XTZ	"Tezos is a smart contract platform that uses blockchain voting to be self-governing by its token holders. Also, the platform aims to boost the security of smart contracts."	1	0.000058	9944721	921655028	4913174	18434
30	Binance-Peg Paxos Standard (PAX)	PAX	Paxos Standard (PAX) is a stablecoin that allows users to exchange US dollars for Paxos Standard Tokens to 'transact at the speed of the internet'.	1	0.000058	127525140	918323105	3571572	1013
31	Binance-Peg BTCB Token (BTCB)	BTCB	"Bitcoin BEP2 (BTCB) is a token on Binance Chain issued by Binance, where the price is pegged to BTC at a rate of 1 BTCB = 1 BTC."	17192.58	0.998771	1109384	918101966	1040168439	518419
32	Chain (XCN)	XCN	Chain is a cloud blockchain protocol that enables organizations to build better financial services from the ground up powered by Sequence and Chain Cloud.	0.04	0.000002	11899116	819203053	16210234	5658
33	Binance-Peg Pax Dollar Token (USDP)	USDP	Pax Dollar (USDP) is a digital dollar redeemable one-to-one for US dollars and regulated by the New York Department of Financial Services.	1	0.000058	1188895	767542322	2430492	568
34	Binance-Peg TrueUSD Token (TUSD)	TUSD	"TUSD is a regulated, exchange-independent stablecoin backed 1-for-1 with US Dollars."	1	0.000058	24798894	756756214	113113000	13145
35	Binance-Peg Zcash Token (ZEC)	ZEC	Zcash (ZEC) is a decentralized and open-source privacy-focused cryptocurrency that enables selective transparency of transactions. Zcash transactions can either be transparent or shielded through a zero-knowledge proof called zk-SNARKs.	46.12	0.002679	23407977	732717139	4612338	6237
36	Decentralized USD (USDD)	USDD	USDD is a fully decentralized over-collateralization stablecoin.	0.98	0.000057	150361770	707406313	107930473	3139
37	Binance-Peg Synthetix Network Token (SNX)	SNX	Synthetix is a derivatives liquidity protocol on Ethereum that enables the issuance and trading of synthetic assets.	2.93	0.00017	78134062	684978265	3223886	9636
38	BitTorrent (BTT)	BTT	"BTT is the official token of BitTorrent Chain, mapped from BitTorrent Chain at a ratio of 1:1. BitTorrent Chain is a brand-new heterogeneous cross-chain interoperability protocol, which leverages sidechains for the scaling of smart contracts."	0	0	13472056	650318223	25188977	29233
39	Fantom (FTM)	FTM	Fantom is a directed acyclic graph (DAG) smart contract platform providing decentralized finance (DeFi) services to developers using its own bespoke consensus algorithm.	0.24	0.000014	78218655	617417170	9990259	76055
40	Binance-Peg Maker (MKR)	MKR	Maker is a Decentralized Autonomous Organization that creates and insures the dai stablecoin on the Ethereum blockchain	620.24	0.036032	14066474	606362985	3101185	4033
41	MIOTAC (IOTA)	IOTA	"IOTA is a distributed ledger with its proprietary technology known as Tangle, a system of nodes that confirm transactions. It aims to offer greater speeds than conventional blockchains and an ideal footprint for the ever-expanding Internet of Things ecosystem."	0.21	0.000012	9391268	583561785	5438692	21653
42	Binance-Peg PAX Gold (PAXG)	PAXG	"PAX Gold (PAXG) tokens each represent one fine troy ounce of an LBMA-certified, London Good Delivery physical gold bar, secured in Brink’s vaults."	1791.21	0.104057	8595086	582518386	537364	2
43	Binance-Peg eCash Token (XEC)	XEC	"eCash is the natural continuation of the Bitcoin Cash project. eCash follows through on key promises such as the innovative Avalanche consensus layer while also introducing concepts such as staking, fork-free network upgrades, and subchains."	0	0	4010857	574648829	1103985	7300
44	Frax Share (FXS)	FXS	"FXS is the value accrual and governance token of the entire Frax ecosystem. Frax is a fractional-algorithmic stablecoin protocol. It aims to provide highly scalable, decentralized, algorithmic money in place of fixed-supply assets like BTC."	6.2	0.00036	4236621	447026598	516367	717
45	Zilliqa (ZIL)	ZIL	Zilliqa (ZIL) is a public blockchain built on a sharded architecture. It has solved blockchain scalability and speed by implementing sharding.	0.02	0.000001	15278071	380411510	3318082	37679
46	1INCH Token (1INCH)	1INCH	1inch is a decentralized exchange aggregator that sources liquidity from various exchanges and is capable of splitting a single trade transaction across multiple DEXs. Smart contract technology empowers this aggregator enabling users to optimize and customize their trades.	0.45	0.000026	15579661	342245569	11214000	99365
47	Binance-Peg Basic Attention Token (BAT)	BAT	The Basic Attention Token is the new token for the digital advertising industry.	0.23	0.000013	22211911	340598602	5708020	22832
8	Binance-Peg Dogecoin Token (DOGE)	DOGE	"Dogecoin (DOGE) is based on the popular ""doge"" Internet meme and features a Shiba Inu on its logo. Dogecoin's creators envisaged it as a fun, light-hearted cryptocurrency. that would have greater appeal beyond the core Bitcoin audience, since it was based on a dog meme."	0.1	0.000006		279719339	12909099485	139141524
48	Binance-Peg Compound Coin (COMP)	COMP	"Compound (COMP) is an ERC-20 asset that powers the community governance of the Compound protocol; COMP token-holders and their delegates debate, propose, and vote on changes to the protocol."	40.06	0.002327	15907675	274662173	2003000	12950
49	Green Metaverse Token (GMT)	GMT	"STEPN is a “Web3 lifestyle app” with GameFi elements on the Solana blockchain. It combines aspects of a play-to-earn game with a fitness app to create a new category coined “move-to-earn.” Users buy NFT sneakers, which they can use to earn in-game currency while walking, running, or jogging."	0.4	0.000023	32621345	242508657	18006799	91503
50	Wrapped USTC Token (USTC)	USTC		0.02	0.000001	10205199	225838207	2200707	82266
51	Binance-Peg IoTeX Network (IOTX)	IOTX	"Building the Internet of Trusted Things  Blockchain, IoT, & Privacy."	0.02	0.000001	3017769	224044187	9557489	37102
52	Binance-Peg yearn.finance (YFI)	YFI	"Yearn.finance is an aggregator service for decentralized finance (DeFi) investors, using automation to allow them to maximize profits from yield farming."	6955.77	0.404082	12256386	217146747	6260193	7365
53	Ankr (ANKR)	ANKR	Web3 Infrastructure for All	0.02	0.000001	14472035	206453915	213656282	39220
54	JUST (JST)	JST	JUST is a (DeFi) ecosystem built for the TRON blockchain. It is an entire suite of products that are mostly centered around a decentralized stablecoin lending platform known as JustStable.	0.02	0.000001	36382600	204888092	575398	880
55	pTokens GALA (GALA)	GALA	"Gala Games is dedicated to decentralizing the multi-billion dollar gaming industry by giving players access to their in-game items. Coming from the Co-founder of Zynga and some of the creative minds behind Farmville 2, Gala Games aims to revolutionize gaming."	0.03	0.000001	44814801	194498681	1447150035	74643
56	Venus BTC (vBTC)	vBTC	Venus is an algorithmic money market and synthetic stablecoin decentralized finance protocol.	870.45	0.050567	0	179170589	556858459	10362
57	Baby Doge Coin (BabyDoge)	BabyDoge	"BabyDoge has learned a few tricks and lessons from his meme father, Doge. He is Hyper-deflationary with a smart staking system built-in. Simply hold while every network transaction in the ecosystem has a 5% fee that is redistributed to the holders."	0	0	1764752	177217925	462000000	1646251
58	Binance-Peg Ontology Token (ONT)	ONT	Ontology is a new high-performance public blockchain project & a distributed trust collaboration platform that include a series of complete distributed ledgers and smart contract systems.	0.19	0.000011	20093760	162920453	3518079	12576
59	SafePal Token (SFP)	SFP	SafePal is a cryptocurrency wallet that helps users to protect and grow their decentralized assets.	0.47	0.000027	8565754	152875933	235627240	156467
60	SafeMoon (SFM)	SFM	Safemoon protocol aims to create a self-regenerating automatic liquidity providing protocol that would pay out static rewards to holders and penalize sellers.	0	0	362116	135593785	242070000	701408
61	Binance-Peg APENFT Token (NFT)	NFT	"APENFT was born with the mission to register world-class artworks as NFTs on blockchain.
It aims to build a bridge between top-notch artists and blockchain, and to support the growth of native crypto NFT artists."	0	0	13143156	130697654	1992371	181647
62	APENFT (NFT)	NFT	"APENFT Fund was born with the mission to register world-class artworks as NFTs on blockchain and aim to be the ARK Funds in the NFT space to build a bridge between top-notch artists and blockchain, and to support the growth of native crypto NFT artists. Mapped from TRON network."	0	0	13597576	130621934	267082	11626
63	Swipe (SXP)	SXP	Swipe is a cryptocurrency wallet and debit card that enables users to spend their cryptocurrencies over the world.	0.25	0.000014	4599191	126224476	72259538	57140
64	Binance-Peg Kyber Network Crystal Token (KNC)	KNC	"Kyber is a blockchain-based liquidity protocol that aggregates liquidity from a wide range of reserves, powering instant and secure token exchange in any decentralized application."	0.64	0.000037	8666335	104813536	3109068	4648
65	Venus USDC (vUSDC)	vUSDC	Venus is an algorithmic money market and synthetic stablecoin decentralized finance protocol.	0.02	0.000001	6687241	103764572	91214143	4644
66	Binance-Peg Smooth Love Potion (SLP)	SLP	Smooth Love Potions (SLP) is a ERC-20 token that is fully tradable.	0	0	6168147	102691966	5370301	32849
67	Prometeus (PROM)	PROM	"Prom is a unified access point to the NFT gaming and metaverse industries that includes an NFT marketplace and aggregator, non-collateralized NFT rental and mortgage, an educational portal and analytic tools, an NFT Launchpad, and DEX for GameFi assets."	5.35	0.000311	5275261	87973269	106958381	4716
68	FLOKI (FLOKI)	FLOKI	The Floki Inu protocol is a cross-chain community-driven token available on two blockchains: Ethereum (ETH) and Binance Smart Chain (BSC).	0	0	1250570	87719661	94200000	356187
69	Synapse (SYN)	SYN	Synapse is a cross-chain layer ∞ protocol powering interoperability between blockchains.	0.62	0.000036	520074	86828262	32322751	3357
70	MDX Token (MDX)	MDX	"MDEX integrates the advantages of multiple chains to create a high-performance composite DEX ecosystem, to maximize the rewards of participants with the ""dual mining incentives"" of liquid mining and transaction mining."	0.09	0.000005	3269031	82734784	29721294	61238
71	Binance-Peg Cartesi Token (CTSI)	CTSI	Cartesi takes smart contracts to the next level by implementing a variant of optimistic roll-ups. Cartesi is revolutionizing smart contracts by allowing developers to code with mainstream software stacks. Noether is Cartesi's high-performance and low cost data availability side-chain.	0.13	0.000007	20509930	82169036	1265700	6476
72	Binance-Peg COTI Token (COTI)	COTI	"COTI is an enterprise-grade fintech platform that enables cross-chain interoperability and is built on its own DAG-based chain. It supports extreme scalability, low transaction costs and is supplemented with payment-specific requirements in the form of COTI Pay, a holistic digital payment solution."	0.07	0.000004	12013722	80105888	1445080	9768
73	ALICE (ALICE)	ALICE	"My Neighbor Alice is a multiplayer builder game, where anyone can buy and own virtual islands, collect and build exciting items and meet new friends. The game combines a fun narrative for regular players and an ecosystem for players who want to collect and trade Non-Fungible Tokens (NFTs)."	1.32	0.000077	9436460	78765288	10560000	53438
74	wazirx token (WRX)	WRX	"WazirX is a India's cryptocurrency exchange with trading interface and features to buy, sell and trade cryptocurrencies."	0.17	0.00001	3836139	77281203	2626630	8911
75	Anyswap-BEP20 (ANY)	ANY	"Anyswap is a fully decentralized cross chain swap protocol, with automated pricing and liquidity system."	4.11	0.000239	5828	76553857	16992319	170022
76	Orbs (ORBS)	ORBS	"Orbs is a public blockchain built for the needs of apps with millions of users, from SLAs to adjustable fee models to on-demand capacity."	0.03	0.000001	1190757	75013949	313629	1774
77	Biswap (BSW)	BSW	"BSW is a deflationary token aims to incentivize the liquidity provision to the Biswap platform. BSW tokens are burned by sending them to the burn address and a total of 6,292,523 has been burned from the original supply of 117,403,378 as of Sep 24, 2021."	0.21	0.000012	8386454	74848717	95463126	146315
78	Binance-Peg Band Protocol Token (BAND)	BAND	Band Protocol is a cross-chain data oracle platform that aggregates and connects real-world data and APIs to smart contracts.	2.05	0.000119	16771509	72238584	6568670	10092
79	Binance-Peg Celer Token (CELR)	CELR	"Celer Network is offering layer-2 scaling platform. It brings interactive, secure and low-cost applications to every blockchain."	0.01	0.000001	6750655	71608355	3176383	24826
80	Binance-Peg Phala Network Token (PHA)	PHA	"Phala Network is a privacy-preserving cloud computing service, which offers computing power comparable to existing cloud services and protects the privacy of managed programs."	0.15	0.000009	29947027	70449106	1224224	8928
81	Binance-Peg ELF Token (ELF)	ELF	aelf is an innovative open-source blockchain network designed as a complete business solution. The structure of ‘one main chain + multiple side chains’ allows developers to independently deploy or run DApps (Distributed Applications) on individual side chains to achieve effective resource isolation.	0.13	0.000008	12850703	68775861	526573	1153
82	AlphaToken (ALPHA)	ALPHA	Alpha Finance Lab is an ecosystem of DeFi products and focused on building an ecosystem of automated yield-maximizing Alpha products that interoperate to bring optimal alpha to users on a cross-chain level.	0.09	0.000005	2808986	67281890	89709187	18768
83	Binance-Peg Bancor Network Token (BNT)	BNT	Bancor is an on-chain liquidity protocol that enables constant convertibility between tokens. Conversions using Bancor are executed against on-chain liquidity pools using automated market makers to price and process transactions without order books or counterparties.	0.38	0.000022	5762996	64171147	750121	1072
84	Reef.finance (REEF)	REEF	Reef Finance is a multi-chain smart yield engine and liquidity aggregator for any DeFi protocol to integrate with.	0	0	16620237	63983125	35733900	102061
85	CertiK Token (CTK)	CTK	"CertiK provides security infrastructure for the blockchain. It features various projects - CertiK security oracle, CertiK shield and CertiK Chain."	0.76	0.000044	6658088	61210685	6903178	16437
86	Binance-Peg YFII.finance Token (YFII)	YFII	"DFI.Money (YFII) is a DeFi platform which aims to build products on aggregated liquidity provision, leveraged trading, automated marketing making."	1519.49	0.088272	27799215	58646262	4102625	1938
87	Venus BUSD (vBUSD)	vBUSD	Venus is an algorithmic money market and synthetic stablecoin decentralized finance protocol.	0.02	0.000001	4039921	58625471	178189766	10895
88	BSC Conflux (bCFX)	bCFX	"Conflux is a public, permissionless blockchain bridging Asian and Western communities and economies, to enable the secure flow of assets and data across borders, protocols and applications."	0.03	0.000002	1543255	57504634	19014394	11018
89	VAI Stablecoin (VAI)	VAI	Venus is an algorithmic money market and synthetic stablecoin decentralized finance protocol.	0.98	0.000057	519	56242524	20138925	13681
90	Alien Worlds Trilium (TLM)	TLM	"Alien Worlds is a NFT blockchain game in the world with over 4,000 unique users per hour.
First-generation collectible-only NFTs were “dead” but Alien Worlds’ NFTs come to life with their gaming utility."	0.02	0.000001	5325667	52157678	29128918	97529
91	Venus (XVS)	XVS	Venus is an algorithmic money market and synthetic stablecoin decentralized finance protocol.	4.24	0.000246	1413012	51629560	127265417	54788
92	DODO bird (DODO)	DODO	"DODO is a on-chain liquidity provider, which leverages the Proactive Market Maker algorithm (PMM) to provide pure on-chain and contract-fillable liquidity."	0.12	0.000007	4396615	51395084	4059895	40964
93	Coin98 (C98)	C98	"Coin98 enables value transfer as easily as using the Internet by the innovation of Multi-chain Engine, Fully Automatic Liquidity and Space Gate, all in one Super Liquidity Aggregator."	0.23	0.000014	12304430	50712183	33634969	55244
94	SAITO (SAITO)	SAITO	"Saito is an open network layer that delivers web3 to users. Applications on Saito can run without closed plugins, private APIs and non-open infrastructure."	0.02	0.000001	731770	44410555	5270823	8777
95	pTokens TLOS (TLOS)	TLOS	pNetwork enables cross-chain movement of assets and data.	0.15	0.000009	1360652	43962972	2365552	9836
96	Unidef (U)	U	"U protocol is a utility token that was created with the aim of being the primary currency for the decentralized web economy. Alongside being a token for governance with voting capacity, U will also be used for payments, transactions, and social interactions in our global networks."	0	0	143933	41861500	240678900	48367
97	AlpacaToken (ALPACA)	ALPACA	Alpaca Finance is the first leveraged yield farming protocol on Binance Smart Chain. It will be integrated with PancakeSwap and allow users to open leveraged yield farming positions by borrowing assets from vaults.	0.27	0.000016	1767402	41173042	48869536	75074
98	StandardBTCHashrateToken (BTCST)	BTCST	Bitcoin Standard Hashrate Token (BTCST) brings exchange-grade liquidity to Bitcoin mining. Each BTCST is collateralized by real Bitcoin mining power.	5.27	0.000306	2167527	38417055	79050000	18443
99	Automata (ATA)	ATA	"Automata is a privacy middleware layer for dApps across multiple blockchains, built on a decentralized service protocol."	0.11	0.000007	4558481	37645319	9153440	20629
100	PolkastarterToken (POLS)	POLS	"Polkastarter is a DEX built for cross-chain token sales and auctions, enabling projects to raise capital on a decentralised and interoperable environment based on Polkadot."	0.38	0.000022	1181488	37368275	9366926	18027
101	Wetux (WETUX)	WETUX	WETUX allows to put your idle crypto-asset to work towards enhancing the neo-economy’s open liquidity.	0.02	0.000001		658927		13940154
102	Wetux (WETUX)	WETUX	WETUX allows to put your idle crypto-asset to work towards enhancing the neo-economy’s open liquidity.	0.02	0.000001		658927		13940154
103	LunaGens (LUNG)	LUNG	LunaGens is a multi-chains Defi focus project. LunaGens goals are to make the crypto space safer for investors and to help educate people about the pros and cons of cryptocurrency. LunaGens also stride to explore the road of building its own blockchain to support the ecosystem and utilities.	0	0		571545		1590820
