serial	token_full_name	token	description	price-usd	price_change_percentage	volume_24h_usd	circulating_market_cap_usd	onchain_market_cap_usd	holders
103	LunaGens (LUNG)	LUNG	LunaGens is a multi-chains Defi focus project. LunaGens goals are to make the crypto space safer for investors and to help educate people about the pros and cons of cryptocurrency. LunaGens also stride to explore the road of building its own blockchain to support the ecosystem and utilities.	0	0		565878		1575790
104	Pylon Eco Token (PETN)	PETN	"Pylon Eco is a DeFi, governance and deflationary open source ecosystem-based project. It claims to features buyback guarantee of all ICO tokens and aims for daily used in plenty of ecosystems to bring mass crypto adoption. It provides staking reward and is backed by guarantee portfolio."	0.38	0.000022		203990		37307635
105	Adonis (ADON)	ADON	"Adonis network is a cryptocurrency launchpad which has a complete blockchain structure that includes Coin, Token, Metavers, Web3.0, Gaming Platform, Defi, NFT and Exchang. Actually it's a multi-chain fundraising platform enabling projects to raise capital and promise safety to early stage investors."	0.08	0.000005		5649		812170000
106	Adonis (ADON)	ADON	"Adonis network is a cryptocurrency launchpad which has a complete blockchain structure that includes Coin, Token, Metavers, Web3.0, Gaming Platform, Defi, NFT and Exchang. Actually it's a multi-chain fundraising platform enabling projects to raise capital and promise safety to early stage investors."	0.08	0.000005		5649		812170000
107	Metegg DeFi (MDEFI)	MDEFI	"Metaegg working on web3 through art, gaming, entertainment, and DeFi. MEGG is a token made to support what’s next, controlled, and built on by the community. It will serve as a decentralized protocol layer for community-led initiatives that drive culture forward into the metaverse, gaming & DeFi."	0	0		1313		26636
108	OKEYCOIN (OKEY)	OKEY	"OKEYVERSE is a project with several subprojects focused on developing de-fi, web3 social media, and play-to-earn games on a single platform. The OKEYVERSE project is unique because it has an underlying real asset, which is co-working space."	0	0		1158		676100
109	OKEYCOIN (OKEY)	OKEY	"OKEYVERSE is a project with several subprojects focused on developing de-fi, web3 social media, and play-to-earn games on a single platform. The OKEYVERSE project is unique because it has an underlying real asset, which is co-working space."	0	0		1122		675100
110	JetSwap Token (WINGS)	WINGS	WINGS is the governance and reward token for Jetswap. It is an innovative AMM (automated market maker) in the Jetfuel Ecosystem.	0	0		496		151110
111	Inescoin (INES)	INES	"Inescoin is the cryptocurrency which allows user to create their domain name and website in the blockchain, with end-to-end encrypted messaging through your wallet address."	0	0		330		63
112	OREO (ORE)	ORE	"Oreo will incentivize Defi creation and financial diversity and return the rights and value to its users.
Oreo aims to build public protocol that carries yield farming value."	0	0		301		3000
113	Cryptonits (CRT)	CRT	"Cryptonits CRT is owned and operated by CRYPTONITS LTD. CRT may be stored, moved from one digital wallet to another, or converted into other digital currencies. The cryptocurrency is based on BEP20."	0	0		225		70732
114	Cryptonits (CRT)	CRT	"Cryptonits CRT is owned and operated by CRYPTONITS LTD. CRT may be stored, moved from one digital wallet to another, or converted into other digital currencies. The cryptocurrency is based on BEP20."	0	0		225		70732
115	Extended Guapcoin (xGUAP)	xGUAP	xGUAP is a wrapped token pegged to the decentralized cryptocurrency Guapcoin ( www.guapcoin.org ). xGUAP tokens are minted when Guapcoin is sent to the wrapped contract. xGUAP can be converted to GUAP at any time and used within the Guapcoin ecosystem ( and vice versa ).	0.01	0.000001		161		1280
116	ENERGY COIN (ENG)	ENG	The Energy Token (ENG) is a cryptocurrency belonging to the Energy Web Foundation (ENG). The Energy Web Foundation is an organization dedicated to building open-source operating systems for energy grids that can help in powering a zero-carbon economy.	0	0		154		67363
117	808TA (808TA)	808TA	"808 Exchange offers great staking & dividend rewards for 808TA Token holders, as well as market trading & swap options. 808 Exchange is user friendly and is constantly updating and upgrading to meet the upcoming demands of crypto space."	0	0		130		917700
118	Pasta Token (PASTA)	PASTA	Pasta finance is a fork of goose finance and offer yield farming protocol.	0	0		109		38501
119	ENERGY COIN (ENG)	ENG	The Energy Token (ENG) is a cryptocurrency belonging to the Energy Web Foundation (ENG). The Energy Web Foundation is an organization dedicated to building open-source operating systems for energy grids that can help in powering a zero-carbon economy.	0	0		82		57075
120	DEFI 100 (D100)	D100	"Defi100 is a aynthetic index token based on the principle of elastic supply. Powered by decentralized oracles to provide the most accurate feeds for the rebase, DEFI100 is a synthetic asset on Binance Smart Chain pegged to DEFI."	0.03	0.000002		72		107022
121	DEFI 100 (D100)	D100	"Defi100 is a aynthetic index token based on the principle of elastic supply. Powered by decentralized oracles to provide the most accurate feeds for the rebase, DEFI100 is a synthetic asset on Binance Smart Chain pegged to DEFI."	0.03	0.000002		72		107022
122	Oceans Finance v2 (Oceansv2)	Oceansv2	Oceans Finance is a decentralized financial asset which rewards users with a sustainable fixed compound interest model through use of it’s unique Rebase protocol.	0	0		70		738276
123	Taco (TACO)	TACO	Taco Finance is a yield farming project on BSC.	0	0		64		79379
124	GrowMoon (GM)	GM	GrowMoon is the first of its kind to introduce a financial utility in the form of 'micro-transactions' taking place for all users within the app.	0.02	0.000001		60		23572
125	GrowMoon (GM)	GM	GrowMoon is the first of its kind to introduce a financial utility in the form of 'micro-transactions' taking place for all users within the app.	0.02	0.000001		60		23572
126	SPORTOKEN (SPT)	SPT	Sportoken birth by fans to be a community driven MeMe token for Sport & E-sport with power of decentralization.	0	0		52		335580
127	Pearl Token (PEARL)	PEARL	"Cryptobay is a play-to-earn metaverse game platform on BSC. Users can buy and build ships, fight against pirates in adventure, fight against players in arena, participate in boss battles, build their own harbors, recruit captains and raise pets."	0	0		47		86688
128	Encyclopedia wTa (ENCwTa)	ENCwTa	Encyclopedia Coin is built on the Binance Smart Chain network. It is a Web 3.0 supported direct information transfer project and is a member of the Metaverse family.	0.01	0		44		36172
129	Krabots (KRAC)	KRAC	"Krabots is the ultimate auto-combat robot fighting game. Users play as Krasers to collect NFT robot parts, assemble and upgrade their ultimate Krabot, and defeat an opponent to move on in the Krabots tournament."	0.02	0.000001		28		1914829
130	HASH (HASH)	HASH	"HASH is a utility BEP-20 and ERC-20 token and fuel of Hashbon FiRe crypto payment ecosystem powered by both DeFi and CeFi products. In September 2021, Hashbon introduced the Hashbon Rocket CDEX platform that enables cross-chain token swaps in a DeFi manner."	0	0		28		2974390
131	Baby Floki Billionaire (BabyFB)	BabyFB	"Baby Floki Billionaire is a meme coin on the BSC, inspired by the Floki Inu meme coins success. It rewards token holders with reflections."	0	0		28		100000
132	Crox Token (CROX)	CROX	A cross-chain Automated Market Making (AMM) decentralized exchange with a deflationary token model.	0.01	0.000001		24		57032
133	Crox Token (CROX)	CROX	A cross-chain Automated Market Making (AMM) decentralized exchange with a deflationary token model.	0.01	0.000001		24		57032
134	INME RUN (INMER)	INMER	"INME RUN, it is an app and game merged together in one app through which you can earn INME RUN tokens while running and playing."	0	0		23		71548
135	CBK (CBK)	CBK	CBK is deployed to tokenize milliseconds of exposure time in the blockchain docuseries “Crossing the Yellow Blocks”.	0.01	0.000001		14		116441
136	Spore Token (SPORE)	SPORE	Spore Engineering is a software factory focused on closing the gap between traditional fintech and industry 4.0.	0.56	0.000033		13		185571
137	Spore Token (SPORE)	SPORE	Spore Engineering is a software factory focused on closing the gap between traditional fintech and industry 4.0.	0.56	0.000033		13		185571
138	Ezcoin Market (ECM)	ECM	"Ezcoinmarket is a crypto tracking price website for the crypto asset, News Cryptocurrency, Signal Futures & Spot Trading, Airdrops, Game and Vote tokens"	0	0		12		24800
139	TOZEX (TOZ)	TOZ	"Tozex is a financing platform that combines a token issuance module “Tokenpad” allowing users to launch token-based crowdfunding campaigns (ICO, STO, and BRO) with an embedded crypto asset marketplace."	0.05	0.000003		5		84654
140	TOZEX (TOZ)	TOZ	"Tozex is a financing platform that combines a token issuance module “Tokenpad” allowing users to launch token-based crowdfunding campaigns (ICO, STO, and BRO) with an embedded crypto asset marketplace."	0.05	0.000003		5		84654
141	Virtual Meta (VMA)	VMA	"The VMA wallet/API not only features the ability for users to exchange VMA across any VR/AR experience, environment or world, but also the ability for users to launch their own branded token coins. VMA will seamlessly allow value transfer from the virtual world to the real world and back again."	0.03	0.000002		5		267099900
142	Virtual Meta (VMA)	VMA	"The VMA wallet/API not only features the ability for users to exchange VMA across any VR/AR experience, environment or world, but also the ability for users to launch their own branded token coins. VMA will seamlessly allow value transfer from the virtual world to the real world and back again."	0.03	0.000002		5		267099900
143	Mithrilverse (MITHRIL)	MITHRIL	"MITHRIL is a deflationary token on the Binance Smart Chain, fueled by memetic energy and an active community of MITHRIL-handed holders. The MITHRIL token yields reflections generated from a 4% tax on all transactions; 2% is sent to liquidity and 2% is distributed to holders."	0	0		5		356977
144	Lucky Unicorn Token (L99)	L99	"L99 token is a type of currency which is used for transactions in the ecosystem of NFT Game Lucky Unicorn – Metaverse. It offers a series of games in which players raise, collect, team up unicorns to do various quests, also they can challenge each other individually or as a guild."	0	0		5		75587
145	8BIT DOGE (BITD)	BITD	8Bit Doge is a Play-To-Earn GameFi Token & NFT Project living on the Binance Smart Chain with all NFT sales going back to the token holders.	0	0		4		112100
146	Recycling Token (CYC)	CYC	CYC is a blockchain-based platform for converting waste and recyclables into real-value CYC tokens. CYC Ecosystem connects people with companies and municipal services and makes it possible to encourage citizens to exercise care with waste utilization	0.01	0		3		7912870
147	Green Chart (GREEN)	GREEN	Empower people to become the smartest self-directed investors they can be by creating accessible investment platforms and services.	0	0		3		136000
148	Green Chart (GREEN)	GREEN	Empower people to become the smartest self-directed investors they can be by creating accessible investment platforms and services.	0	0		3		136000
149	Xpose (Xpose)	Xpose	XPOSE PROTOCOL wants to go to extreme measures in enlightening the world. We make epic memories and use xtreme marketing events to build an extraordinary community. XPOSE community members help in this journey to positively impact the world.	0	0		2		9230000
150	Safechaintoken (SCT)	SCT	Safechaintoken is a hyper-deflationary utility token for the Safechaintoken ecosystem.	0	0		1		85580
151	BUX Token (BUX)	BUX	The BUX Platform Token offers BUX as an utility token that can be used on the BUX Crypto platform to access premium features and promotions.	0.49	0.000029		0		37784063
152	BUX Token (BUX)	BUX	The BUX Platform Token offers BUX as an utility token that can be used on the BUX Crypto platform to access premium features and promotions.	0.49	0.000029		0		37784063
153	VANCI.FINANCE (VANCII)	VANCII	Vanci.Finance was developed to bestow its holders for their token loyalty by granting them extraordinary farming rewards. The tokenomics allows holders to be rewarded in both BNB and Vanci tokens for the duration of their holding timeframe.	0.3	0.000017		0		8996
154	VANCI.FINANCE (VANCII)	VANCII	Vanci.Finance was developed to bestow its holders for their token loyalty by granting them extraordinary farming rewards. The tokenomics allows holders to be rewarded in both BNB and Vanci tokens for the duration of their holding timeframe.	0.3	0.000017		0		8996
155	RobustSwap Token (RBS)	RBS	RobustSwap by the Robust Protocol team is a decentralized exchange (DEX) with yield farming and automated market maker (AMM) on the Binance Smart Chain designed to optimize profitability through scarcity and liquidity.	0.26	0.000015		0		27861
156	RobustSwap Token (RBS)	RBS	RobustSwap by the Robust Protocol team is a decentralized exchange (DEX) with yield farming and automated market maker (AMM) on the Binance Smart Chain designed to optimize profitability through scarcity and liquidity.	0.26	0.000015		0		27861
157	Keep3r BSC Network (KP3RB)	KP3RB	KP3RB token is a Keep3r fork project on Binance Smart Chain.	0.14	0.000008		0		184725128
158	Keep3r BSC Network (KP3RB)	KP3RB	KP3RB token is a Keep3r fork project on Binance Smart Chain.	0.14	0.000008		0		184725128
159	Weather (Weather)	Weather	Weather finance is a yield farming protocol on BSC.	0.1	0.000006		0		9142
160	Weather (Weather)	Weather	Weather finance is a yield farming protocol on BSC.	0.1	0.000006		0		9142
161	Genta (GENA)	GENA	"Genta (GENA) is a token with optional uses cases. It can be used for shares, stake, and converting liquid assets. Genta are backed by Tulsa Pro Project."	0.1	0.000006		0		1998897
162	Genta (GENA)	GENA	"Genta (GENA) is a token with optional uses cases. It can be used for shares, stake, and converting liquid assets. Genta are backed by Tulsa Pro Project."	0.1	0.000006		0		1998897
163	Dogestribute (DGSTB)	DGSTB	"Dogestribute is an NFT, gaming, and rewards token. The first game is ready to play on launch with weekly rewards for the top scores."	0.05	0.000003		0		45220
164	Dogestribute (DGSTB)	DGSTB	"Dogestribute is an NFT, gaming, and rewards token. The first game is ready to play on launch with weekly rewards for the top scores."	0.05	0.000003		0		45220
165	Kiwi Token (KIWI)	KIWI	KiwiSwap is a decentralized financial project builts on BSC which features yield farming and staking.	0.03	0.000002		0		12440
166	Hot Cross Token (HOTCROSS)	HOTCROSS	Hot Cross is a multi-chain tool suite. It aims to be a toolbox for EVM networks and expand to non-EVM chains in future.	0.01	0.000001		0		2488608
167	Hot Cross Token (HOTCROSS)	HOTCROSS	Hot Cross is a multi-chain tool suite. It aims to be a toolbox for EVM networks and expand to non-EVM chains in future.	0.01	0.000001		0		2482063
168	cheesemaker.farm (CHS)	CHS	CheeseSwap is a DeFi swap/exchange platform.	0.01	0		0		20160
169	Ramen Token (Ramen)	Ramen	"RamenSwap Finance is a community driven yield farming, DeFi yield aggregator and DEX aggregator on Binance Smart Chain. Users can earn RAMEN by staking it on the pool and farming it by provide the liquidity to earn more delicious RAMEN."	0.01	0		0		143030
170	Monverse (Monstr)	Monstr	"Monverse is a multi-chain combat and strategy game, originally designed and developed on BSC."	0	0		0		14816
171	SiaCashCoin (SCC)	SCC	The SiaCashCoin storage network is decentralized. SiaCashCoin will not require owned storage locations or identifiable nodes.	0	0		0		19112501632
172	PizzaSwap (PIZZA)	PIZZA	Pizza finance is a yield farming project partnered with cheeseswap and keep3rb.network.	0	0		0		0
173	ARRANO (ANDX)	ANDX	"Arrano Network is a Collaborative workspace for the development of fair crypto products like Decentralized Exchange, P2P model, Trader Analytics, Academy, launchpad and others. ANDX is the native DeFi token of the ecosystem that fuels up the operations."	0	0		0		0
174	Axelar Wrapped USDC (axlUSDC)	axlUSDC		0	0		0		0
175	Bitovia (BTV)	BTV	BITOVIA is an ecosystem that opens new horizons for you.	0	0		0		0
176	CAR (CAR)	CAR	The $CAR token can be converted into a Blind Box NFT. Those boxes will contain one of the different Car NFT designs. Three of those Car NFTs will allow the lucky holder to own a real-world exclusive car.	0	0		0		0
177	Cars (CARS)	CARS	An NFT 3D racing game based on BSC.	0	0		0		0
178	Catjam (CATJAM)	CATJAM	Catjam is a community-driven meme coin.	0	0		0		0
179	Chi Gastoken by 1inch (CHI)	CHI	"Chi Gastoken by 1inch.exchange is a more optimized gas token solution then everything existing on the market. Shorter contract address, using create2 and some assembly optimizations provide lower gas costs on minting and burning calls."	0	0		0		0
180	Cream Cardano Token (crADA)	crADA	"C.R.E.A.M. Finance is built on the belief that the financial system of the future should be open and inclusive. Through the permissionless nature of blockchain and automation of smart contracts, they aim to realize this new financial system."	0	0		0		0
181	Curate on BSC (XCUR)	XCUR		0	0		0		0
182	DoYourTip (DYT)	DYT	$DYT is a deflationary ERC20 token with a 2% burn rate. It combines the deflationary feature with off-chain tipping and Enjin collectibles.	0	0		0		0
183	FC Porto Fan Token (PORTO)	PORTO	"FC Porto Fan Token is built on the Binance Smart Chain empowering FC Porto fans with broader accessibility, more functionalities and lower fees."	0	0		0		0
184	Fomotion (FOMO)	FOMO	$FOMO is a token by crypto Youtuber 'Fomotion'. The community asked for a token so here it is.	0	0		0		0
185	fry.KetchupV2 (KHP)	KHP	fry.Ketchup ($KHP) is the official governance token of fry.world Finance.	0	0		0		0
186	HappinessToken (HPS)	HPS		0	0		0		0
187	InnovativeBioresearchCoin (INNBC)	INNBC	"INNBC is a crypto-asset issued by Innovative Bioresearch Ltd, a biotech company performing novel biomedical research in the field of HIV, cancer, and regeneration research, as well as developing decentralized solutions for processing scientific data."	0	0		0		0
188	Kripton Black (LPKB)	LPKB	A full-fledged financial inclusion platform with hybrid crypto-fiat and self-credit scoring aiming to be the future of microfinance and decentralized finance by providing financial tools to underdeveloped countries.	0	0		0		0
189	Kripton Mobile (LPKM)	LPKM	A full-fledged financial inclusion platform with hybrid crypto-fiat and self-credit scoring aiming to be the future of microfinance and decentralized finance by providing financial tools to underdeveloped countries.	0	0		0		0
190	Kripton P (LPKP)	LPKP	A full-fledged financial inclusion platform with hybrid crypto-fiat and self-credit scoring aiming to be the future of microfinance and decentralized finance by providing financial tools to underdeveloped countries.	0	0		0		0
191	Kripton Q (LPKQ)	LPKQ	A full-fledged financial inclusion platform with hybrid crypto-fiat and self-credit scoring aiming to be the future of microfinance and decentralized finance by providing financial tools to underdeveloped countries.	0	0		0		0
192	Kripton T (LPKT)	LPKT	A full-fledged financial inclusion platform with hybrid crypto-fiat and self-credit scoring aiming to be the future of microfinance and decentralized finance by providing financial tools to underdeveloped countries.	0	0		0		0
193	Kripton X (LPKX)	LPKX	A full-fledged financial inclusion platform with hybrid crypto-fiat and self-credit scoring aiming to be the future of microfinance and decentralized finance by providing financial tools to underdeveloped countries.	0	0		0		0
194	Kripton Y (LPKY)	LPKY	A full-fledged financial inclusion platform with hybrid crypto-fiat and self-credit scoring aiming to be the future of microfinance and decentralized finance by providing financial tools to underdeveloped countries.	0	0		0		0
195	Kripton Z (LPKZ)	LPKZ	A full-fledged financial inclusion platform with hybrid crypto-fiat and self-credit scoring aiming to be the future of microfinance and decentralized finance by providing financial tools to underdeveloped countries.	0	0		0		0
196	Lunar (LNR)	LNR	Lunar token contract has migrated to a	0	0		0		0
197	Lunar (LNR)	LNR	Lunar token contract has migrated to a	0	0		0		0
198	LUNCHero (LCH)	LCH	LuncHero is the voice of each and every LunC lover and supporter.	0	0		0		0
199	Milk Protocol (MILK)	MILK	MILK Protocol is an experimental DeFi degens on Binance Smart Chain. Always DYOR before investing in any project.	0	0		0		0
200	Moeda SEEDS (SEEDS)	SEEDS	"Moeda.Finance is the parallel DeFi infrastructure of Moeda, a blockchain powered digital payment and micro lending ecosystem."	0	0		0		0
201	Perlin (PERL)	PERL	PerlinX is democratizing the trading of real-world assets through decentralized liquidity pools and synthetic asset generation.	0	0		0		0
202	Robust Reward (RBW)	RBW	RBT is an experimental BEP20 deflationary token on the Binance Smart Chain.	0	0		0		0
203	Shield Protocol (SHIELD)	SHIELD		0	0		0		0
204	SOOMA (SOA)	SOA	Sooma is a deflation token.	0	0		0		0
205	Standard on xDai on BSC (xMARK)	xMARK	"Benchmark Protocol mitigates liquidation events and hedges risk with the MARK token; a supply elastic, stablecoin-alternative that connects traditional capital markets to DeFi."	0	0		0		0
206	Sun Token (SUN)	SUN		0	0		0		0
207	Super Vote LAUNCH (svLAUNCH)	svLAUNCH		0	0		0		0
208	Switcheo Token (SWTH)	SWTH		0	0		0		0
209	Torum (XTM)	XTM		0	0		0		0
209	Tree Token (TREE)	TREE	Binance Charity Foundation has launched this Australian Bushfire Donation project to help alleviate the impact of this disaster and facilitate the restoration for Australian community.	0	0		0		0
210	Trivian Token (TRIVIA)	TRIVIA	"Trivians is a crypto-powered trivia game app which enables players to win Trivian Token according to their correct answers at different game modes and competitions. It is the new generation trivia game, with a totally unique Battle Royale approach without any geographical and language restrictions."	0	0		0		0
211	TRON (TRX)	TRX		0	0		0		0
212	Tutu Token (TUTU)	TUTU	Payment Facilitator for Foreign Tourists. A global instant payments app for tourists using the local payment system recharged with Bitcoin. Freedom to make payments while traveling with automatic conversion from Crypto (Bitcoin) to local FIAT.	0	0		0		0
213	VIRSACOIN (VIR)	VIR	VIRSA is a new governance token that completes the Social ecosystem by putting control of the protocol in the hands of the community.	0	0		0		0
214	Xpose Protocol (XP)	XP	"A community-driven, social marketing ecosystem powered by blockchain. Xpose establishes a first-of-its-kind decentralized ecosystem that transforms the way brands run marketing campaigns."	0	0		0		0
215	Axelar Wrapped USDC (axlUSDC)	axlUSDC		0	0		0		0
216	Bitovia (BTV)	BTV	BITOVIA is an ecosystem that opens new horizons for you.	0	0		0		0
217	Chi Gastoken by 1inch (CHI)	CHI	"Chi Gastoken by 1inch.exchange is a more optimized gas token solution then everything existing on the market. Shorter contract address, using create2 and some assembly optimizations provide lower gas costs on minting and burning calls."	0	0		0		0
218	FC Porto Fan Token (PORTO)	PORTO	"FC Porto Fan Token is built on the Binance Smart Chain empowering FC Porto fans with broader accessibility, more functionalities and lower fees."	0	0		0		0
219	LUNCHero (LCH)	LCH	LuncHero is the voice of each and every LunC lover and supporter.	0	0		0		0
220	Trivian Token (TRIVIA)	TRIVIA	"Trivians is a crypto-powered trivia game app which enables players to win Trivian Token according to their correct answers at different game modes and competitions. It is the new generation trivia game, with a totally unique Battle Royale approach without any geographical and language restrictions."	0	0		0		0
221	TRON (TRX)	TRX		0	0		0		0
222	NDB (NDB)	NDB	"Blockchain-based NDB Ecosystem that facilitates trading, tracking, and paying (and otherwise managing) energy in new ways among peers and with personal devices, utility providers, and other stakeholders and components. At its center, the NDB Ecosystem is developed, managed, and governed by NDB Hub."	0.01	0.000001	3		13213940000	120
223	NDB (NDB)	NDB	"Blockchain-based NDB Ecosystem that facilitates trading, tracking, and paying (and otherwise managing) energy in new ways among peers and with personal devices, utility providers, and other stakeholders and components. At its center, the NDB Ecosystem is developed, managed, and governed by NDB Hub."	0.01	0.000001	3		13207070000	120
224	GG TOKEN (GGTKN)	GGTKN	Utility Token For Lottery & Gambling Portals. GGTKN is also accepted on various e-commerce projects around the world. Full list available on the official website.	0.1	0.000006	19327		1213365022	21067
225	GG TOKEN (GGTKN)	GGTKN	Utility Token For Lottery & Gambling Portals. GGTKN is also accepted on various e-commerce projects around the world. Full list available on the official website.	0.1	0.000006	19327		1210210933	21067
226	Jointer (JNTR)	JNTR	JNTR is a liquidity bridge that serves as a transfer of value between traditional commercial real estate equity and blockchain based digital currencies.	0.02	0.000001	71461		238936923	5276
227	Jointer (JNTR)	JNTR	JNTR is a liquidity bridge that serves as a transfer of value between traditional commercial real estate equity and blockchain based digital currencies.	0.02	0.000001	72200		236550989	5276
228	Okse (OKSE)	OKSE	"Okse Wallet and Okse Visa Card are a decentralized finance system, built to revolutionize the financial market. Okse Wallet and Card allows only the owner to access and spend their cryptocurrency without counter-party risk in over 60 million shops worldwide."	0.13	0.000008	560351		132767000	4867
